{
    "case_id": "c64eff5b-630a-4910-931e-66828cbd8fd2",
    "created_at": "2025-10-28T17:16:33.392730",
    "status": "active",
    "conversation": [
        "Severe cold and cough and blocked nose for 12 hours"
    ],
    "last_symptoms": {
        "chief_complaint": "Severe cold and cough and blocked nose for 12 hours",
        "raw_output": "{\n\"chief_complaint\": \"Severe cold and cough\",\n\"duration_days\": 12,\n\"severity_self\": \"Severe\",\n\"associated_symptoms\": null,\n\"risk_factors\": null,\n\"age_band\": null,\n\"medications\": null,\n\"allergies\": null\n}"
    },
    "triage": {
        "severity_level": "AMBER",
        "rationale": "Symptoms are severe and persistent, but not necessarily life-threatening. Should see a GP/telehealth provider soon for further evaluation.",
        "recommended_action": "referral",
        "red_flags_triggered": [],
        "care_instructions": []
    },
    "action": {
        "action_type": "referral",
        "tasks": [
            "Rest and hydrate.",
            "If symptoms worsen, seek medical help promptly.",
            "This information is not medical advice. Seek professional help if uncertain."
        ],
        "follow_up_due": "2025-10-30T05:17:06.414314"
    },
    "summary": {
        "user": "### \ud83e\ude7a Summary for You\n- What you reported: Severe cold and cough and blocked nose for 12 hours\n- Triage level: **AMBER**\n- Reasoning: Symptoms are severe and persistent, but not necessarily life-threatening. Should see a GP/telehealth provider soon for further evaluation.\n- What to do now: **referral**\n- Next steps:\n  - Rest and hydrate.\n  - If symptoms worsen, seek medical help promptly.\n  - This information is not medical advice. Seek professional help if uncertain.\n- Follow-up due: 2025-10-30T05:17:06.414314\n\n> \u26a0\ufe0f This information is for triage support and not a medical diagnosis.",
        "clinician": "### \ud83d\udc69\u200d\u2695\ufe0f Clinician Handover Summary\n- Chief complaint: Severe cold and cough and blocked nose for 12 hours\n- Duration (days): None\n- Associated symptoms: None\n- Severity (self): unknown\n- Triage level: AMBER\n- Rationale: Symptoms are severe and persistent, but not necessarily life-threatening. Should see a GP/telehealth provider soon for further evaluation.\n- Red flags: None\n- Recommended action: referral\n- Tasks / Care Instructions:\n  - Rest and hydrate.\n  - If symptoms worsen, seek medical help promptly.\n  - This information is not medical advice. Seek professional help if uncertain.\n- Follow-up due: 2025-10-30T05:17:06.414314"
    }
}